{
  "endpoint": {
    "owner": "a2",
    "controller": "127.0.0.1:9097",
    "managed": true,
    "configPath": "/Users/alice/.a2/mihomo/config.yaml"
  },
  "group": "PROXY",
  "url": "http://www.gstatic.com/generate_204",
  "timeoutMs": 5000,
  "results": [
    { "node": "香港 01", "delayMs": 120, "timeout": false },
    { "node": "日本 02", "delayMs": 300, "timeout": false },
    { "node": "慢节点", "timeout": true }
  ]
}
